"","category","name","price","ratings","no_of_reviews"
"1","Dress","Women's 2023 Summer Puff Sleeve Smocked Floral Dress Crewneck Lace Flowy Tiered Midi Dresses","$218.66","4.2 out of 5 stars","1,741"
"2","Dress","Womens Summer Floral Print Puff Sleeves Vintage Ruffles Midi Dress","$56.30","4.1 out of 5 stars","2,363"
"3","Dress","Cotton Muslin Dress for Women Summer Casual Party Holiday Beach Lace Long Robe Dresses Vestido","$37.17","4.6 out of 5 stars","3"
"4","Dress","Women's V Neck Short Sleeve Ruched Drawstring Side Split Party Bodycon Midi Dress","$87.80","4.3 out of 5 stars","1,200"
"5","Dress","SWFO221069 Women's Lace Dress","$121.04","4.5 out of 5 stars","4"
"6","Dress","Cut Out Dresses for Women Summer Sleeveless Cutout Waist Bodycon Mini Tank Dress Sundress","$73.75","4.3 out of 5 stars","5,514"
"7","Dress","Women's Knee-Length Beach Dress Long Sleeves Swing Tunic Casual Dresses Summer Loose Dress Floral Print V-Neck Beach Dress Mini Dress Sexy Elegant Boho Women Blouse Dress","$67.85","4.5 out of 5 stars","170"
"8","Dress","Women's Asymmetrical Shirred Tulip Dress","$56.57","4.2 out of 5 stars","595"
"9","Dress","Women Sexy Twist Knot Front Ribbed Knit Bodycon Bandeau Tube Dress Casual Solid Strapless Maxi Long Dress",NA,"4.3 out of 5 stars","675"
"10","Dress","Women's",NA,"4.0 out of 5 stars","658"
"11","Dress","Women's 2023 Summer Boho Spaghetti Strap Square Neck Solid Color Ruffle A Line Beach Long Maxi Dress",NA,"4.3 out of 5 stars","198"
"12","Dress","Women's Short Sleeve Collared Polo Dress",NA,"3.8 out of 5 stars","15"
"13","Dress","Women Casual Summer Short Ruffles Tiered Sleeve Smocked Midi Dresses Bohemian Floral V Neck Wedding Guest Long Dresses",NA,"4.2 out of 5 stars","1,790"
"14","Dress","Satin Silk Backless Tube Tops Maxi Dress for Women Low Back Hollow Out Elegant Strapless Long Dresses Wedding Guest",NA,"4.0 out of 5 stars","416"
"15","Dress","Cocktail Plus Size Dresses Women Casual Long Sleeves O Neck Slit Irregular Hem Plus Size Long Dress Wool Dresses for Women Plus Size",NA,"3.9 out of 5 stars","1,513"
"16","Dress","Womens Casual Midi Dresses Solid V Neck Short Sleeve Button Shirt Belted Dress with Pockets for Spring Summer",NA,"4.0 out of 5 stars","308"
"17","Dress","Women's Short Sleeved Princess Seamed Sheath Dress",NA,"3.9 out of 5 stars","72"
"18","Dress","Womens Puff Sleeve Square Neck Puffy Dress Babydoll Mesh Mini Dress High Rise Flare Organza Party Dress",NA,"4.3 out of 5 stars","33,291"
"19","Dress","Women's Casual, Long Sleeve",NA,"3.2 out of 5 stars","4"
"20","Dress","Spliced Tassel Sleeveless A-line Dress for Women's Tassel Skirt",NA,"4.1 out of 5 stars","493"
"21","Dress","Indian Women's Mustard Poly Silk Ethnic Dress",NA,"2.5 out of 5 stars","3"
"22","Dress","Bodycon Dress for Woman Long Sleeve Knee-Length Ruffle Sleeve Off Shoulder Evening Dress",NA,"3.9 out of 5 stars","17,510"
"23","Dress","Women's Casual Shirt Dress Ruched 3/4 Sleeve Button Up Mini Dresses",NA,"4.3 out of 5 stars","53"
"24","Dress","Women's Retro Summer Midi Dresses Polka Dot Printed V Neck Short Sleeve Beach Party Dress High Waist A-Line Sun Dress",NA,"4.0 out of 5 stars","292"
"25","Dress","Women's Short Sleeve V-Neck Dress",NA,"4.2 out of 5 stars","13,647"
"26","Dress","Women's Casual Loose Maxi Dress Sleeveless Slit Summer Beach Dress with Pockets",NA,"4.3 out of 5 stars","161"
"27","Dress","Women's Vintage Sleeveless Solid Floral Ruched Summer Cute A-Line Flowy Swing Midi Dress",NA,"3.8 out of 5 stars","447"
"28","Dress","Women's Dress",NA,"3.9 out of 5 stars","134"
"29","Dress","Women's Floral Button Down Vintage Polka Dots Dresses Collar Tie Belted Shirt Dress",NA,"3.9 out of 5 stars","48"
"30","Dress","Women's Lace Flowy Mini Dress Y2k Sleevelss Backless Slip Dress Drop Waist Short Tunic Dress Lingerie Nightgown",NA,"4.2 out of 5 stars","152"
"31","Dress","Women's Jewel Neck Scuba Crepe Dress",NA,"3.8 out of 5 stars","7"
"32","Dress","Series 7",NA,"4.4 out of 5 stars","43"
"33","Dress","Womens Dresses V-Neck Spaghetti Strap Bowknot Backless Sleeveless Lace Mini Swing Skater Dress",NA,"3.8 out of 5 stars","25"
"34","Dress","Womens Plus Size Dresses Womens Casual Sweatshirt Dress Long Sleeve Mock Neck Wrap Hem Loose Fall Winter Long Pullover Dresses Older Women Skirts",NA,"4 Stars & Up",NA
"35","Dress","Womens Tie Dye Dress Plus Size Casual Boho Sundress Summer Sleeveless Dresses",NA,"3 Stars & Up",NA
"36","Dress","Women's Star Heart Floral Print Casual Square Neck Short Sleeve Flare Dress",NA,"2 Stars & Up",NA
"37","Dress","Women's Autumn Winter Cotton Long Sleeves Elegant Knitted Bodycon Tie Waist Sweater Pencil Dress",NA,"1 Star & Up",NA
"38","Dress","Daphne Dress Regency Dress Women's Blue Lace Dress",NA,NA,NA
"39","Dress","Women's Long Sleeve Cotton V-Neck Button Up Floral Print Boho Flowy Midi Dresses",NA,NA,NA
"40","Dress","Women's Knot Front Midi Dress",NA,NA,NA
"41","Dress","Alex Evenings","$89.48","4.0 out of 5 stars","241"
"42","Dress","Womens Summer Casual Dress Loose Batwing Sleeve Crew Neck Chiffon Cape Elegant Midi Cocktail Pencil Dresses for Women UK for Funeral Party Wedding","$154.98","4.0 out of 5 stars","357"
"43","Dress","Women's Breton Stripes Sleeveless V-Neck Stretch Cotton Polo Dress","$230.93","4.5 out of 5 stars","183"
"44","Dress","Women's Elegant V Neck Wrap Knit Dresses Batwing Sleeve Backless Slit Mini Dress","$77.39","5.0 out of 5 stars","2"
"45","Dress","Women's Dress","$91.23","3.8 out of 5 stars","7"
"46","Dress","Women's Side Waist Tie Fit and Flare Dress","$92.31","3.4 out of 5 stars","3,236"
"47","Dress","Women's Button Up Floral Print Split Beach Maxi Dresses","$150.44","3.7 out of 5 stars","144"
"48","Dress","Summer Dress for Women Long Sleeve Casual Plaid Print Smocked Off Shoulder A-Line Midi Dress","$142.42","3.6 out of 5 stars","231"
"49","Dress","Women Sexy Backless Draped Maxi Dress Elegant Sleeveless Spaghetti Strap Evening Dress Long Club Party Beach Dress","$289.93","4.2 out of 5 stars","5,638"
"50","Dress","Ladies Cute Sleeveless deep V-Neck Dress, Summer Casual Dress","$107.16","4.0 out of 5 stars","174"
"51","Dress","Women Vintage Elastic Square Neck Ruffled Half Sleeve Summer Backless Beach Flowy Maxi Dresses","$102.74","4.0 out of 5 stars","126"
"52","Dress","Women's Audrey Spaghetti Strap Midi A-line 3D Floral Dress","$248.35","4.3 out of 5 stars","1,793"
"53","Dress","MedeShe Women's Christmas Long Sleeve V Neck Velvet Maxi Dress","$65.35","4.0 out of 5 stars","985"
"54","Dress","Womens Cotton Embroidered High Low Long Dresses","$98.84","4.2 out of 5 stars","599"
"55","Dress","Women's Long-Sleeved Mini Dress Checked Dress Turtleneck Knitted Dress A-line Sweater Autumn Dress Loose Dresses Pullover Dress for Winter Autumn",NA,"4.3 out of 5 stars","504"
"56","Dress","Women's Tunic Dress Fall Linen Button Down Long Sleeves Casual Mini Shirt Dress",NA,"4.3 out of 5 stars","111"
"57","Dress","Women's 2 Piece Mesh Panel Beaded Neck Jacket Dress",NA,"4.2 out of 5 stars","21,317"
"58","Dress","Women's Midi Dress",NA,"4.0 out of 5 stars","348"
"59","Dress","Women's Summer Maxi Dress Casual Loose Pockets Long Dress Short Sleeve Split",NA,"4.6 out of 5 stars","15"
"60","Dress","Women's Polka Dot Slim Fit Half Sleeve Dresses Square Collar Long Midi Dress",NA,"4.2 out of 5 stars","1,122"
"61","Dress","Women's Shift Dress",NA,"5.0 out of 5 stars","2"
"62","Dress","Women's Summer Dress Square Neck Short Sleeves Crossover Waist Casual Party Mini Dress",NA,"4.3 out of 5 stars","52"
"63","Dress","Women's Slit V Neck Maxi Long Dress, Summer Solid Casual Smocked Waist Boho Vacation Party Beach Dress Evening Maxi Dress for Women 2023 (Color : Dark Green, Size : Medium)",NA,"3.2 out of 5 stars","10"
"64","Dress","Elegant Long-Sleeved Dress Long-Sleeve Women Fall Spring V Neck Long Sleeve Flower Print A-line Loose Hem Big Swing High Tight Waist Lady Prom Party",NA,"3.9 out of 5 stars","431"
"65","Dress","Sam Feldt, Mr. White, YAX.X and Robin Schulz - Sensation",NA,"4.4 out of 5 stars","53,153"
"66","Dress","Women's Twist Neck Halter Maxi Dress",NA,"4.1 out of 5 stars","355"
"67","Dress","Women`s Summer Dress Chest Bow V-Neck Short Sleeve Boho Floral Printed Swing Above The Knee Mini Dress",NA,"3.9 out of 5 stars","1,718"
"68","Dress","Women's Casual Day Dress",NA,"3.7 out of 5 stars","2,571"
"69","Dress","Women's Kendall 3/4 Elbow Bell Sleeve Sheath Dress",NA,"4.0 out of 5 stars","33"
"70","Dress","Women's Sleeveless Mini A-Line Fit and Flare Plaid Dress",NA,"4.3 out of 5 stars","1,603"
"71","Dress","Women's Tunics Tops Bell Short Sleeve Lace Casual T Shirts Blouse",NA,"4.0 out of 5 stars","9,528"
"72","Dress","Women's Short Sleeve Blouson Beaded Gown",NA,"4.2 out of 5 stars","206"
"73","Dress","Women's Summer Straps Cotton Irregular Polka Dot Ruffles Midi Dress",NA,"4.3 out of 5 stars","46"
"74","Dress","Women's Summer Cotton Polka Dots Puff Sleeves Bow Casual Off-Shoulder Boho Midi Dress",NA,"4.2 out of 5 stars","467"
"75","Dress","Women's Vest_Sole Casual Dress",NA,"4.4 out of 5 stars","501"
"76","Dress","Women's Maxi Bodycon Dress Sexy Spaghetti Strap Sleeveless Tight Slip Long Dresses 2023",NA,"4.1 out of 5 stars","1,136"
"77","Dress","Women's Halter V-Neck Patchwork Mini Short Dresses",NA,"4.3 out of 5 stars","161"
"78","Dress","Sharagano",NA,"4.1 out of 5 stars","7"
"79","Dress","Women's Scuba Crepe Cold Shoulder Dress",NA,"4.1 out of 5 stars","244"
"80","Dress","Women's Plaid Square Neck Ruffle Puff Sleeve Midi Dress Summer Boho Backless Smocked Dress",NA,"4.3 out of 5 stars","2,020"
"81","Dress","Women's Scuba Crepe Cold Shoulder Dress","$248.35","4.3 out of 5 stars","46"
"82","Dress","Women's Plaid Square Neck Ruffle Puff Sleeve Midi Dress Summer Boho Backless Smocked Dress","$104.25","4.2 out of 5 stars","467"
"83","Dress","Women's Long Shift Dress Illusion Neckline (Petite and Regular)","$65.35","4.4 out of 5 stars","501"
"84","Dress","Womens Short Sundress Flowy Boho Beach Dress with Embroidered V Neck, Casual Sexy Summer Party Dress","$98.84","4.0 out of 5 stars","45"
"85","Dress","Women's Sneaker Dress","$100.91","3.9 out of 5 stars","30"
"86","Dress","Women's Floral Vintage V Neck 3/4 Sleeves Flare Button Front Midi Dress","$81.15","3.2 out of 5 stars","23"
"87","Dress","Women's Midi Dress","$56.86","3.4 out of 5 stars","7"
"88","Dress","Women's Livia Midi High Dress","$199.03","4.1 out of 5 stars","7"
"89","Dress","Women's","$372.25","4.1 out of 5 stars","244"
"90","Dress","Women's Contrast Doll Collar Short Sleeves Above Knee Flare Dress","$187.66","4.3 out of 5 stars","2,020"
"91","Dress","Women Vintage 1950s Retro Rockabilly Prom Dresses Cap-Sleeve","$19.89","4.3 out of 5 stars","16,843"
"92","Dress","Women T Shirt Dress Crew Neck Loose Plain Casual Plus Size Midi Dress with Pockets","$79.87","1.0 out of 5 stars","2"
"93","Dress","Women's Sneaker Dress","$223.54","4.6 out of 5 stars","451"
"94","Dress","Women's Vest_Kameron Casual Dress","$297.08","4.4 out of 5 stars","137"
"95","Dress","Women's Shirt Dresses Sleeveless V Neck Midi Dress Striped Pleated Ruffle Tunic Tops Casual Dress with Button","$83.11","4.1 out of 5 stars","586"
"96","Dress","Womens Summer Long Sleeve Cardigan Sexy Maxi Dresses","$91.84","3.8 out of 5 stars","5,122"
"97","Dress","Women's Bohemian Vacation Beach Dress Ruffle Sleeve Belt Loose Front Slit Midi Dress","$116.12","4.4 out of 5 stars","613"
"98","Dress","Women's 2023 Summer Boho Spaghetti Strap Square Neck Solid Color Ruffle A Line Beach Long Maxi Dress",NA,"4.1 out of 5 stars","1,176"
"99","Dress","ZESICA",NA,"5.0 out of 5 stars","4"
"100","Dress","Women's Woman Knit Dress Long Sleeve",NA,"4.0 out of 5 stars","1"
